{
  "id": "customer-transformation",
  "createdAt": "2024-01-01T00:00:00.000Z",
  "title": "Customer Transformation Story",
  "businessId": "acme-brand",
  "description": "Before and after story from a real customer. Combine testimonial with results.",
  "source": "Customer email",
  "platform": "any",
  "format": "undecided",
  "pillarId": "promote",
  "priority": "high",
  "status": "evaluating"
}
